clean_text,is_depression
i ve had depression for a long a i can remember really some day i m sad for absolutely no reason that s how today started now i m in my head and i m more depressed than i ve been in a very long time i hardly ever cry i haven t cried in probably month i m cry right now i m fucking sobbing like a lil bitch my boyfriend is in jail not sure how long month idk i live in our house with our year old he s my sister kid but i have custody my best friend ha depression and her boyfriend struggle with drug and she work a very full time job she doesn t reply much to me anymore i m not mad at her i know her life it very tough and she struggle with depression a well i m just sad because she s my go to person and now i m lucky if i get a reply i m 0 day clean from fentanyl so the chemical in my brain probably aren t in the greatest shape i miss my other best friend i saved all of our video and picture she wa my best friend from around 0 0 i wa in a very toxic relationship and she constantly tried to break u up rightfully so once i finally broke up with him the girl and i we fine we were great one night we went to a party and then the next day i went home and wrote her a long text telling her she wa toxic towards her boyfriend we got into a huge fight then they started stupid rumor about me trying to get with her bf wasn t true then i went 00 step too far i got with this new guy who wa total gang gang and a snow addict at the time i knew a window in her house wa broke and could always open while she wa at school my new man and his friend robbed her house and by rob i mean only took the bong and weed that wa one of the biggest mistake of my life the whole time it happened i sat at home have an anxiety attack because i wanted to tell my man nevermind but i didn t want him to think le of me how fucking cool of me i have a very guilty conscience and i m empathetic a fuck i ended up telling her the truth she already knew she s not stupid i knew she wanted to kill me the moment i confessed to her face a week later i ended up giving her 00 00 to make up for what wa taken i hoped she would want to continue our friendship but it wa over i don t blame her i wa the toxic one all along i needed to do deep soul searching well now it s 0 and that happened year ago i still think about her everyday i miss her more than ever i love her soul and that s rare to find i ve been looking at all our old video picture that i saved to my eye only on snapchat i have hundred of snap of u my point is if anyone is actually still reading do i try to message her on facebook or should i just be happy that she wa apart of my life did i forever ruin what could have been i feel like i m just getting through everyday not living i m prescribed very strong sleeping med i m tempted to take a couple but i won t i m tempted to walk to the gas station and drink my sorrow away but that ll only make thing worse i could go across the street and sit on the swing in the park but it s dark now i m just babbling on about nothing i feel like it s the loneliness talking,1
that mental struggle when you know you should reach out because you think you might sh but a big part of you doesn t want to try too hard to get help because f everyone and everything amp x 00b i ve tried half heartedly all day to reach out to people but no one ha responded with anything other than their own issue i guess posting here is kinda reaching out part of me doesn t want to do it but most of me is just angry and want to put that into something,1
m i have been dealing with depression anxiety panic attack for 0 year and also have adhd i kind of suck at everything i am failing my rd university almost have no social life have no girlfriend for year no job no goal and no achievement i have been trying to get my life together for year i quit alcohol and cannabis completely i am working out regularly forcing myself to socialize and learn new skill and trying to date failing miserably i am only successful at quitting drug which i can relapse anytime i suffer month of a year have some good day so what is the point of living if i won t be happy and achieve anything what kind of man i am who can not attract a woman and never be able to and why do i bother to live if i am failing every job i took and every university i went to i always feel lonely hate myself and can t look at the mirror anymore i am about to give up but i can t decide please answer objectively thanks,1
it been like this for so long and my first problem ha always been there it will never go away if i were to change this problem i wouldnt be me anymore it started when i wa a mute child now i have social anxiety and depression i never received treatment the first time when i wa and got prescribed and then they stopped suddenly i dont have anything i dont even have a friend to tell nor an adult i cant just seek help i dont trust anyone at all and im far too scared to even speak about it because i go silent when i have to talk about thing like this im so i have no way to seek help for myself i dont have any friend at school and i havent had any for year every time i try to make one i just cant keep up and it so exhausting trying to talk and i just never speak again a lot of people hate me i wa verbally bullied in some school no one wa ever there to help me ive been alone for so long it been getting so much worse with constant de realization severe intrusive thought and at this point i cut myself everyday i genuinely dont see a future anymore,1
im a year old guy in highschool i suffer from bipolar depression and have been addicted to painkiller before and went through rehab during my freshman year during my addiction i had a girlfriend and we decided to go to a dance together she didn t show up my first reaction wa to not worry but all my friend had their date and we re having fun i immediately went into a panic and took too many pill i overdosed and almost died i decided to break up with my girlfriend after the incident and felt it wa best we moved on now i m a junior the first year i m allowed to go to prom and i don t wan na go i m single this year and all my friend have date and are probably going to have fun i don t think i will enjoy myself i don t want to relive a traumatic experience that nearly killed me my parent want me to go because they feel it is really important and will show my emotional growth they say that me going will make them happy and called me selfish when i said i wasn t going my dad keep telling me that i m going and that i need to look for a suit and stuff pretending like nothing is wrong my mom is telling me that i m selfish for not going and that it would make them happy if i would go i don t know what to do can i get some advice,1
it wa dumb they were talking about what day do they put out trash and i said something like every day is trash day if you hate yourself but still go outside they nervous laughed and looked at me asking if i wa serious and i said well everyone hate themselves a little bit and they just didn t respond cool just me ok lol,1
i ve been struggling with motivation to do anything work related for the last month or so because i m depressed a a result i m super far behind on a lot of stuff my manager hasn t really noticed because i ll get the thing done that they need but i m in a really bad place mentally this week and i have done almost no work on a big project that i need to finish by tomorrow i ve been debating going out on fmla for the last few week but i have to use up all of my vacation time if i do go out i ve been seeing a therapist weekly and i ve been on wellbutrin for a month my doctor just increased my dosage yesterday it really hasn t done much for me up to this point do i just take fmla until i get my depression under control i feel like i m stuck between a rock and a hard place i hate disappointing people but this depression is debilitating i m also really scared to even start the process for fmla,1
i feel like everything i do i get tired of very quickly i dont feel like challenging myself or bettering myself when something happens to me i put myself down real quick im functional enough to get out of bed clean myself and go to work but thats really it nothing else my interest in activity isnt there i used to be on 0 mg of sertaline a year and a half ago but i got off it thats back when i wa suicidal and to be honest i have improved just not to the extent i think i should have i thought my brain would start getting back into a completely healthy rhythm by itself but it didnt thankfully im not suicidal and the fact i admit i want to improve is a very good sign,1
at first i thought i wa being picky but i kid you not i ve worked at over 0 different company over the last ten year don t get me wrong some job were garbage and had high turnover to begin with but other job people would go crazy over from some of the most reputable company in my area to the easiest work for great pay many of these job are not in a field i m passionate about the work stagnates i become disengaged and i quit if it s not that my coworkers or my supervisor suck if it s not that the schedule is off if it s not that the pay is off hell if it s not any of that a speck of dirt landed on my shirt so screw this place i m leaving i m terrified of being stuck somewhere i don t want to be and it gradually defining my career but the more i jump around the more time i waste in the process people younger than me are becoming my bos and i sit here wondering exactly what i m doing with my life and what i even want to be doing with my life i m year old i haven t had a long lasting job let alone a solid romantic relationship in over a decade the more time that creep by the harder it get i ve worked so many job now and have become so experienced doing so many different task i can very quickly spot out a bad gig or come to a decision if it s an environment i want to be in when i wa a kid working the only job i ve spent more than three year at my supervisor told me i should be a drifter in life and jump from town to town at the time i didn t think much of it today however i wonder if that s really what my true aim should be considering i ve kind of been doing that for most of my adult life anyway fuck,1
idk who s going to read this but it doesn t matter i m only writing this for myself i always had friend growing up i wasn t the most popular kid but i had my small group recently some drama happened and i m no longer in the group i wa wronged and i will play the victim because i am i don t have any friend now i haven t got a few year i fell into a terrible life style the only thing i do with my life is go to college work then rot in my bed consuming medium it took a while but it hit me during one of my break away from school and work i realized that i have nothing making me happy i wake up and go on my phone watching random shit all day in my bed at night i m afraid to sleep so i just consume medium until i can t stay awake any longer i recently started think about what make me happy nothing i have no interest to pursue no friend to talk to no life to live i ve seen everywhere that in order to find yourself you should start a hobby based on your interest that s bullshit coming from people that don t have these problem i don t have interest no hobby appeal to me saying find a hobby that interest you is like me telling you to start a hobby that you don t like i don t like anything anymore i don t know who i am and i don t know how to find myself being betrayed by the people closest to you is a blessing and a curse i know they weren t real but i also know loneliness i can t crawl out of this state because i ve got nothing i want to do how do i become curious how do i start to desire thing again i m so lost i don t even know if i have depression or something all i know is i m constantly hurt unless i m consuming medium being idle just hurt i don t know where else to say this,1
i literally feel empty and hollow i feel like i m slowly just losing touch of what it mean to be alive i had people to talk with for awhile and it wa great it made me smile knowing i wasn t lonely anymore but look like that disappeared from me the one i talk to just stopped no concern no care just treated a a stranger that really broke my heart i feel so sad and unmotivated about anything anymore it such bad timing because i figured what i wanted to do in life and this come to weigh me down i literally feel like ending it would give me a sense of peace for once i don t know what to do so much stress is on me i don t know how to deal with it anymore what am i supposed to do now,1
i m crippled by my past mistake i had the perfect life and threw it all away now i m with someone who treat me like shit and i m staying because i feel like that s what i deserve every day is a struggle and i m ready to be done with this life i ve ruined the world would be better off,1
it s been and a half month now the depression is getting way worse with suicidal thought antidepressant don t help me at all trazadone moklobemid i can not cope with his death i ve dropped out of uni my life is meaningless now i have 0 hope i don t look forward to anything anymore all relationship i have now feel empty also i m an adult now year old i don t think it s even possible to make real friend at this age i ve grown up alongside him went through middle and high school with him all the memory i have with him are just a burning memory now and the worst of all is when you don t believe in god or afterlife anymore you just know that your best friend is nothing but a brain rotting in a cold grave right now and you won t ever see him again never ever,1
i dont bother doing anything all day and im failing college yet im still tired and im constantly thinking about suicide,1
that one week wa the best in a long time around month of constant depression ha quite honestly made me want to kill myself but i have too many people in my life for that i m grateful for having supportive friend and family member but i just want to die,1
been feeling my worst bought of depression in year i m not very socially graceful and i had a substance abuse problem for a long time clean year and sometimes i worry i pickled my brain lol because what s common sense to most people doesn t really register for me i get dismissed by people a lot and i m really struggling at work because of it i m looking for a new job unfortunately nothing pay a well a my current job and i m already living paycheck to paycheck i recently got a cat though and she help with the loneliness,1
i did not have a good day today felt confused and felt like i had no control over my own life but i m reminding myself that i need day like these to really appreciate the good one even though it feel like i ve been in this rough patch for a while and at time it s been really hard to keep going it is the hope that will get me trough this and is getting me trough it right now those feeling of dread and complete defeat can get the best of you and have you seeing no happy ending for everyone reading this i just want you to continue having hope for a brighter day and so will i you are strong,1
do you ever just day dream of an alternate reality where your the main character where your almost like a superhero and everyone love you and your life is so perfect and you have all the thing you want life like your in a movie then you return to face your reality of sadness and face that grimness of it all i do this almost daily it s depressing,1
my father is very smart he ha so much achievement in his education and he always graduated top on his class his dream profession wa to become an engineer but because they were poor he wa not able to pursue it back then he would always persuade to become an engineer now i m at college studying engineering but i am struggling to keep up with college whenever i share to them my struggle they just expect me to easily overcome it i cry every night thinking that i am just a failure and a disappointment to my family this ha all started when i wa still in elementary and have been reaching a top in the class i wa introduced to the computer and got hooked by it i basically grew up in high school facing my computer most of the time i would no longer study and just play all night long not knowing the impact it that would cause me today my habit have completely changed i became malnourished my education ha deteriorated and i graduated high school not knowing how to add a simple fraction now i am at college i am struggling to keep up especially math and i have a failing grade we have a programming subject and what i have realized is that i actually feel happy when taking the lesson i have been thinking to change my career instead but i know my family would not agree i have so many thought right now about what ifs but the urge to just end my life is too strong because i know at this point of my life i have no chance to succeed i have been thinking about this for week i have completely lost my faith and motivation i am disappointed in myself knowing if i would continue it would only get worse i ve already prepared everything i m only waiting to actually be able to pull the trigger,1
i hate this shit that is called life and myself a well i seriously just wan na be normal and mentally stable i turn in month i suffer from bipolar adhd and severe social anxiety lol and i live in a country that do not give two fuck about mental health not even my family know about this they just think am weird i always find it extremely hard to be social or have a solid jobe interview without sweating or going completely red lol i also have some leftover acne scar so that made it alot worst have one friend that i feel a connection with and i love that i mean hopefully thing will get better am in my last year of college or i will get the courage to and my miserable life,1
hey last year i went through a horrible horrible depression and it s wa because i wa going through a lot and i wa always doing thing for people i forgot about myself and this year i just want to focus on me but it s like people from my past are trying to come back into my life and i don t want nothing to do with them i m also trying my best to protect my energy so sometimes i get in a mood of i don t want to talk to anyone like i m perfectly fine just being alone and it s like human these day don t understand this they get upset i don t want to be a bad person but i just can t handle too many friend or a lot of people in my life just hanging out in the background if i could just be alone forever i honestly would i been through so much trauma i don t trust anybody,1
i m a 9 year old male currently in college doing engineering living with my parent i love my parent and they love me and you know the pandemic for the last year forced college to be online learning so i m at home studying with no job yes my parent pay for my education and everything i feel very depressed every day and i became this awful person that yell back at my parent and me sitting at home made me very lazy that if my mom tell me to do a chore then i become angry now is it that i don t have a job i feel depressed and lazy i know i need to change this anger inside of me but don t know how to start the next step thanks for reading this please share what you think,1
coming from an asian household i ve been told to become a doctor since the age of the constant pressure for good grade led me to repeat my senior year of highschool drop out of university graduate from a local college and then re enroll to another program then drop out since my parent hated the program i graduated from i want to thank them for the support they showed especially when they called me useless dumb an embarassment and how they would disown me now i m year old with a fairly decent working from home job that i may get fired from since i ve ignored my workload due to cycling back into a depressive state i now purely cope by playing video game and jerking off i live everyday day dreaming and at the same time regretting my wasted youth all the while my parent look at me with disdain and remind me whenever they can about how i ruined my life that s the end of my ted talk fuck my life man,1
i m having a horrible night and i m too nervous to call the suicide crisis hotline i just need someone to talk to really bad please,1
i don t know if this is the right place but i just want to get this out of my system somewhere and a journal won t do if it doesn t belong here please delete my girlfriend and i are in an open relationship we both agreed on it and i never had any problem with it but after year of trying i have had zero success while my girlfriend can basically choose and it hurt it hurt seeing her choose other guy over me it hurt knowing she d rather spend time with them than with me what hurt the most is seeing her being happy listening to her talking about how exciting it is how much self esteem she gained from it and thus knowing that if i ever tell her that it hurt me i ll make her sad and i don t want to make her feel said even if it mean cry myself to sleep while she is having fun with our friend it s not her issue though she is always asking beore and afterwards if it is okey checking in on me and she would stop this instant if i would tell her about any of this but i know it would still hurt and limit her losing this part of her life and i can t and don t want to do that because i know that if i loose her my life would get miserable i d most likely stay the rest of my life alone and die alone i d lose almost everything positive in my life and i d rather die than having to live 0 miserable year alone thanks for putting up with my ridiculous and self inflicted shit and just remove it if it doesn t belog here,1
anyone who also went through a heavy depressive state not moving around eating or doing anything etc know how to get their appetite back most day i ll only have one meal and that ll be it but i went to the doctor today and they said i might actually contract an illness a a result of this and would like to get me tested so i kinda wan na start fixing up,1
m i ve been in a major spiral the last half a year or so with all kind of major issue coming up all at once i went to the hospital for sa in january and had to go back only a month later for sh and alcohol abuse on my campus usually when i get depressed however i get really really sad or destructive towards myself or i reach for weed or drink to keep me from thinking about thing but tonight is different i ve managed to keep myself from the drink so far tonight and i m out of edible so i can t vibe like that and i m having my usual spiraling out of control thought and feeling incredibly shitty but i also kind of just feel nothing normally i d be a wreck cry on the floor right now but i just feel like a hollowed out egg like my skin is only millimeter thick and the slightest tap will cave me in i can t emote at all i feel like i want nothing not even death rn just pure nothingness and it suck anyone have any experience with these feeling is this some sort of disassociation because i ve never had this acute of an experience before hopefully someone see this,1
i feel like nobody really care if i m gone even my closest friend replaced and forgot about me i just want to sit in my room and rot i just want to stop existing last night wa the worst i couldn t sleep because i broke down and my head keep screaming i want to die i want to die i want to die i don t know if i want to ever get better when there s nothing to get better for i even got excited because i got covid before and thought if it get worse i could finally die but i just had to get better it wa my one chance to die and i got better i m so sick of living i m so sick of being abandoned by people i thought cared about me i just want to be gone and stop existing it s so painful it hurt to cry every night and exhaust myself to sleep in that way even waking up had me cry i m just waiting for something to happen to me so i don t have to kill myself instead to save my family from the shame they d experience if i took my own life instead,1
so i had a really really rough childhood growing up my parent were abusive to me and i lived in an area where i got into a lot of fistfight trying to make it to the next day wa the hardest battle i attempted suicide by trying to hang myself when i wa i think the attempt failed however it left me with some minor brain damage i have a very difficult time trying to remember thing and think about thing sometimes at time it feel like i can t even read english it just doesn t click with me i ll sit and stare at it for like minute at a time before i finally understand it a for the memory issue i have a difficult time recalling some thing that have happened i will completely forget about something that happened say minute ago that most people would instantaneously remember anyway so i ve been feeling extremely strange lately i moved away from my parent after i turned and now i live in a completely different state and i am doing much better but i feel like i m still there i feel the aura of my childhood house it felt heavy if that make sense something keep weighing me down i m also smelling food that aren t being cooked food that i used to eat when i wa there i smelled a very strong scent of digiornio s pizza earlier but nobody here wa cooking it i ve also been sleeping in through the day and waking up at night so this weird feeling is intensified by like 0 time everything feel so dreamlike and liminal i can t tell the difference between reality and fiction anymore why doesn t anything feel real am i wrong to distrust my eye ha anyone else felt this way it would bring me great comfort to know that i am not alone,1
