clean_text,is_depression
i think this is mental breakdown but over the past few month thing have been slowly building up for me and i seem to have finally snapped last week my daily routine is basically wake up shit shower brush and sit on the pc until i go back to bed i eat whenever i feel like it i know it sound and it a shit schedule but it s like the only structure i have in my life a boring and shitty a it is it s always the one thing i can kinda find comfort and stability in anyways the final thing happened that made me snap last week i now wake up and just kinda sit in my bed for a while brush my teeth go walk outside for an hour and then drive around for a few hour then i come back shit shower and the only thing i have left is to sit on my pc but it is borderline painful to do that idk what it is but i just can t handle wasting my time on the pc anymore i ve more or le ditched my online friend and any game video song that i used to enjoy all day i want to be out of the house a much q possible and dread the place that i ve spent so much time in comfort i dread going back to my safe space and wan na avoid it for a long a possible,1
i know not many people will see this or probably care but i have no one or at least no one who ll genuinely listen a year or two ago i wasn t the best person selfish and careless i wa an alcoholic and a drug addict to deal with everything which i know now wa a horrible coping mechanism but it wa all my year old brain knew how to do a addiction ran in my family i wa hypersexual with no fundamental understanding of consent because all i knew wa assault i would get drunk and say horrible thing and my action reflected that i know trauma isn t an excuse for everything i did to people i used to call my friend but i swear i never meant to hurt anyone i wa horrible and when i realized how much hurt i had caused i never let myself live it down i couldn t look at myself the same i would cry for hour because i wa a monster that brought trauma to others life i honestly didn t know how to be healthy and i didn t know how to make real friend without making it sexual because that s all i thought people wanted from me i know these are a bunch of bullshit excuse but i don t know what to do i never wanted to be this person i left the school that wa once my haven because of the rumor i can t tell who i am anymore am i the monster they think i am i barely remember anything and i wa always drinking so it s all a blur amp x 00b i m a girl i m and this is where it started i m not going to give my life story just the bit that matter i wa accused of assault almost a year ago now with many other claim that had to do with my toxicity the original person who accused me and i had dealt with it privately and she had recognized that i wa extremely drunk when it happened and the lack of communication on both end honestly i have taken accountability for the fact that i shouldn t have drank underage and made her uncomfortable i remember bit and piece of that night some of it i can t even put together in my head but i realized that my behavior wa unacceptable and it wasn t okay not okay in the slightest but it got out to my whole school rumor began and people i had past romantic and sexual relationship with accused me of either assaulting them or being toxic i left the school and sought a lot of therapy but the rumor have entered my life in a more public setting i don t blame anyone i wa honestly a piece of shit but i know everything wa consensual but now i m not even sure of anything i think i m a monster i don t know what s real and what isn t i wa manipulative and a downright horrible person but i ve done everything i can to change and apologize but i can t seem to do it right i want to take accountability and be better but also want my name out there on the internet associated with these thing my parent don t deserve this i want to be able to be normal again but then i realize my life ha been normal i ve always through trauma my life is basically one big thing of trauma whether i realize it or not i m so sorry i really hate myself for hurting the people i did i don t want pity and i know nothing i can do can fix my reputation i don t even think i deserve it i really think i should just kill myself i think that d give the people i hurt peace of mind i don t think i deserve to live this life i m really sorry i know you ll judge me too but i promise i m really trying to be better and to help people i m not sure which perception is real theirs or mine i m broken down and i wan na be a kid again with my favorite stuffed animal maybe just take a nap and then i ll wake up and be okay,1
i used to be quite smart aced everything in high school had best result from my school in maturity exam european equivalent to sat used to do extra curricular shit like attending science fair going abroad for competition and shit used to play the piano play sport i wa in a pretty good shape etc i did well even during my first year of college then covid happened i stayed home got lazy played video game all day kinda stopped taking school and friend seriously year later and i am still in a slump i somehow managed to not drop out but nothing interest me now i dont want to do anything nothing make me happy most of the time i am alone and just sit in my room and watch video or play some shit while procrastinating my duty my grade got worse my back hurt i lost my shape can not run for more than minute my sleep schedule is all over the place i stay up until am and i either sleep like hour a day or hour all the time i am thinking about how i peaked in high school and am just wasting my life now i dont cry or anything a i wa never really in touch with my emotion so i dunno if this is depression burnout or what i just want to not feel like a piece of shit all the time i used to have high standard for myself now i cant seem to reach the bare minimum in order to exist normally doe anyone feel the same how do i get out of this state of mind,1
so many mistake every decision made wrong so many wasted opportunity so much brutality so much evil so much sadness so much loneliness so much failure so much betrayal so many addiction so many false hope too many failure to bear how long can my heart beat with this suffering how long until i give up,1
lately all i basically is sleep i just don t have the energy for anything else these day i wa told i need more intensive treatment but i just don t have the energy for that a sad a that sound lmao i just want to end this,1
i just hit something hard i mean i ve been numb before the loss of feeling ha even killed relationship but after the breakup of the best bf i ve ever had numb ha been more common keep in mind it s been abt a week so far well lately with how he s acted and everything and because he even said so i thought we had a chance to work again in the future we broke up because he is suffering mental issue well today he told me he actually lost feeling i also had a small issue with a close friend over lying and smoking and i flipped all my past trauma clicked in right there all the past ex and friend and just people who lied and left me it all hit again which it s crazy to me he triggered it but maybe it s because of the connection i once shared with him but hearing that he lied when he said a couple day before that he still loved me and just wa struggling at the time and all the little flirting and care he s shown feel so contradicting to the point everything clicked off i cried it all out and the emotion wont come back but not even the emotion feel gone i feel like i lost my soul like i wa just blackout drunk my whole life and i just woke up and only recall blurry scene from my life and it s all gone i ve distanced myself from a few close friend and rn only have my bsf and sister im really talking to i cant tell if i fucked up or what but it all is so hazy and confusing i lost whhat im doing and idk what this is or what to do to somehow bend up a better person out of this it s awfully terrifying and it s making me so light headed,1
lately i ve had very strong feeling of hopelessness like i m just wasting my life away i don t want to be around people most of the time i purposely try to avoid social situation i also noticed that if i m feeling an emotion such a anger i can feel it throughout my entire body i m tired of isolating myself and feeling like my life isn t worth anything i ve had thought of not wanting to be here anymore but i know that i won t act on it i hate feeling this way and i don t know what to do to fix it i ve gone to a psychiatrist but i feel like they don t really listen to what s going on and they are more worried about the medication i m taking if anyone ha any suggestion or natural remedy please share i m tired of feeling this way,1
getting out of bed every day feel like a pain i feel like rotting in my bed all day even completing minor task make me feel drained and lethargic i m not sure who i am anymore i don t have the energy to talk to anyone yet i m desperate for love and affection i m trying all i can to cry but it s not working could someone kindly tell me if i m depressed,1
i swear i can be doing so good doing well with my exercise with my nutrition just overall doing well in life but then that little fucking voice come back and tell me i can t do it it s a little voice but it s so fucking loud i can t keep letting it get the better of me but it s so hard sometimes i just wish i had someone here to keep me grounded but i have no one i wish i wa loved enough for people to check up on me but no one care about me fuck this stupid fucking mental disorder,1
i don t know how to answer the question do i tell them i hate everyone and everything and want to die do i say eh and invite fake concern do i just keep exhausting myself by keeping this mask on and go along with the stupid i m okay small talk do i play it up with im doing great and keep pretending that nothing is ever wrong i m sick of all of it i ve just started staring people with a shit eating grin until they get uncomfortable whenever they ask this dumbass question,1
i am a male who should be having the time of his life in college meeting new people getting a degree experiencing all that life ha to offer in reality i dont want to be here any more i feel that i am in people life to help them through their stuff and then one they re fix im out of their life i feel like there are maybe people in the world that would miss me if i wasn t here i feel like everything i do on a daily basis is to keep an appearance that i want to live and that i am doing thing for me i have never been this close to just accepting the fact and just not waking up tomorrow i know it might hurt some people that i know but i am dont suffering in silence and i am done with this facade that i have to keep up every single day of my life my life feel like it is on repeat the same thing happen and i dont feel anything besides not wanting to be here i dont feel emotion like others do i can go from laughing like im about to cry to a straight face within second i dont feel sadness i dont feel happiness like others i am in a constant state of numbness i dont want to play this game anymore im done with it there no one i trust that i can share this with and no one in my life truly understands this,1
another day i do not feel alive i do not feel like i matter i do feel like i am in the way and i do feel like my dream are my only escape lately i have had more anxiety or stress dream tho last one wa about the world ending and everyone rich enough could get a ticket to go on lot of huge spaceship ticket price wa low enough for my aunt and uncle to afford it left without a bother at all for me being alone it felt so strange seeing them board that ship and how little they cared the price wa like 00 000 dollar per person then added in wa pet and i have cat cat cost 00 per cat i could not afford it so i wa left alone just watching ship after ship leaving some malfunctioned and crashed it wa weird watching idk im just tired of feeling alone or abandoned even in my dream and how people dont get how much my cat matter to me they are here for me every day wish insomnia would go away too just another post from a living dead soul sorry,1
nothing in life is enjoyable not to mention that i have like missing assignment i could be doing right now,1
i wa doing nothing and suddenly she just say why did you even live useless maybe i m overreacting but this really hurt me she took care of me since i wa a kid because my mom wa working overseas i wish i wa never born damn this world fuck everything,1
i just can feel it i can t explain it but i can feel it i feel like this is my true self and if it go on i ll lose it,1
last year when i wa i wrote a suicide note before attempting to suicide by overdose i tried to commit suicide because i wa a closeted gay atheist in a really conservative muslim country and family i tried to pray the gay away i endured listening to a lot of homophobia and unfair religious teaching and i couldn t take it anymore i wrote it in arabic translate i felt like my life is unlivable i felt like i wa living a lie i felt like a bomb that it is about to explode at any moment i felt lonely even though i wasn t alone i felt like there is something wrong with just my existence i felt like my happiness will be an unforgivable sin i felt like my truth is a secret that must be hidden this life is cruel and unfair the only place where i can find peace is my grave amp x 00b the overdose wa not enough to end my life i woke up in a hospital and it severely damaged my liver no one read my suicide note yet i am trying to stay alive and hold on to the last hope i have,1
too long to explain but im having an episode rn and it feel horrible day in so far it doesnt ever feel like itll go away i guess i just need some reassurance that this fewling wont stay till i die i just need to know that this feeling will go away soon and i can go back to being happy like i wa before,1
pretty much everyone in my family ha depression or bipolar and i m no exception i m just so worried that it ll make thing worse i m definitely moderate functioning i can go to work and kinda be an ok parent i m not going to off myself even though i have the ideation sometimes but i know life could be much better i might be able to actually do the thing i enjoy in my free time again maybe i won t have the constant brain fog and forgetfulness but what if i end up just feeling numb what if medication make it worse what if i go to a doctor and they won t help i ve never been to a legitimately helpful doctor looking up review doesn t help real talk did medication actually help or make it worse how did it work out for you,1
i just found out my boyfriend is depressed i really want to be there for him but i feel like i ve only been saying the wrong thing how can i be there for him help him and see him get better i m worried it will continue to the point it will consume him i can already see his personality changing and i m scared for the future what thing can i say or do to comfort or help,1
i m not sure of even how to put it into word i m exhausted i ve moved into my own place i ve recently started a new job i m overwhelmed i don t want to die but i also feel like i don t want to exist if that make sense i m trying my best but at this point i feel like my best isn t actually my best i m not sure how to fight these feeling of inadequacy or how to fight off regret over thing i have acknowledged my mistake i ve made and will never make them again but somehow still manage to beat myself up and regret every mistake i ve ever made i hate feeling like this can i just not be tired for one day not be overwhelmed for a day,1
my depression ha been at it worst this year after suffering some significant loss i m going to college in the fall and i want to look forward to it but i cant i chose a state school so i wouldnt have debt and figured i d find a way to pay for it easily all my plan fell through and i only have a couple thousand in scholarship nowhere near enough to cover it i missed so many deadline and screwed up so much because i have no one to help me in my life no reliable adult or friend one of my best friend wa awarded a full tuition scholarship and i want to be overjoyed for her but i just feel so horrible about myself i tried so hard in high school with my grade and music and it amounted to nothing thousand dollar in scholarship is all i have to show for it i cant get any help from fafsa and i have a job but working is horrible when i can barely get out of bed how do i keep going when i have no one to support me and nothing to keep going for,1
now i cant go work in the hospital and enjoy the little fucking thing i do and learn there an all the people i like talking to and i got ta be stuck here for a week with a busted ankle who i dont even know if it will work properly again or not anymore either this year get better or idk but im just tired of every fucking bad this happening to me all the time i thought i wa finally gon na have a job and a boyfriend and turn out the guy doesnt even like me and the manager never called me again at least i wish i had someone that loved me he could come visit and we could talk all night long at this point i really need some cuddle at least,1
not overtly i ve never said the word good bye obviously but i ve begun to try and have good final moment with the people i care about just to them one last time make a nice meal for them have a phone call with someone i haven t talked to in awhile tell people i love them just making the round so the people i leave behind have one last positive memory of me is it overly dramatic maybe but i feel better about what i need to do at least,1
hi idk if anyone will comment and thats okay i just need to talk or something since i m just so tired of my thought and just this worthless feeling i have all the time dealing with depression is no joke and being in a small town suck more since there not many resource or help for me i ve gotten a little help here and there but have just fallen back to being in my room isolating myself i have suicidal thought quite often and worry i might act on them not soon mind you just scared of myself i think of plan on how i could do it i ve written letter directed towards family member and friend before though i keep them to myself i ve self harmed before but haven t for quite sometime though i worry i may resort to that again i really just want help but i have no idea how i can even get it anyhow i thank anyone for reading if you did i don t have a lot of hope left but i guess i m still alive so yeah,1
i know they have good intention but lot of the time they make me feel worse i don t like it when they ask too many question when i withdraw yet when i go to tell them my actual problem they indirectly tell me to get over it and don t think im depressed sometimes it seems like my mood is an inconvenience for them so they want me to be happy so they can be happy it s draining i m tired of them being nosy when when i need to be alone stop asking me to who i m talking to stop asking me what i m doing when i m not doing anything stop looking at my stuff and asking me question stop getting upset with me for being in a bad mood or trying to force me to be happy again i can t this is why i hate socializing with anyone in general it take up too much energy that i don t have and i m tired of having to hide whatever this heaviness i m feeling inside to make others happy i m tired of being the caretaker and human note pad to vent at all day i m tired of putting on a mask and pretending to be happy when i feel like garbage i hate myself i m tired all the time i feel like a failure and a waste of space i just want to be alone i don t want anyone to look at me,1
i got a supporting family a girlfriend who love me more than anything else i ve got friend i ve got a job i ve got hobby i wa born wealthy and had a very good education i ve tried med for a long time psychologist and psychiatrist been to ward but im still just a sad now a i ever wa what am i meant to do what s left i still feel like shit all the time and don t have any reason to there are so many justifiable reason for people to be depressed but i have none of those instead what s even scarier is the idea that this is just innate and always what s in me people say suicide is a permanent solution to a temporary problem but in no way is this problem temporary and it doesn t seem fixable either,1
i tried to tell my boyfriend another family member and a few different friend how much i ve been struggling and have been completely ignored i can guarantee if it all got too much for me they d all be the first to ask why didn t she tell u,1
i ve been on mirtazapine 0mg daily for over a month now and seroquel 0 mg daily for just over two week i can t take it i ve been eating everything and making myself sick to my stomach gained weight have strange dream insomnia foggy brain and increased suicidal thought and i ve been more depressed than i ever have before i understand that medication take time to work but it doesn t feel like i have time i have talked to my psychiatrist family doctor and been to the hospital for an adjustment but to no avail i couldn t stick it out anymore so i went cold turkey on them both day ago i know that this is an incredibly stupid decision without the advising of a doctor but i can t handle it anymore i m wondering what should i expect for withdrawal symptom,1
hey reddit this may be long and just me talking about random shit but i just feel like it would make me feel better so a you guy saw it wa my th birthday today and today wa probably one of the shittier day i have my best friend had a pretty bad panic attack today and i chilled with him to comfort him but it made me kinda realize how lonely i am i have friend and a loving family but i just feel deep and dark loneliness during most day i can kinda just ignore it and have mediocre day but most day like today i just think about it i don t want to make it a big deal because my friend is going through some tuff shit right now and i need to help him a much a i can but i just feel like laying down and doing nothing for a while obviously i can t do that with all the homework and exam coming up but i just don t know what to do like i wa saying earlier i just feel so empty when i m by myself and sometimes i feel like a have no personality i feel like people only like being around me when i m high because i m a lot more talkative and just more enjoyable to be around i don t know it s hard for me to talk to people about it because i feel like they might just blow it off or something and my friend deserves all the attention i just feel bad that i m feeling bad if that make sense like my friend is hurting and i feel bad that i feel so empty i m starting to think that life won t have a lot to offer for me i m not suicidal or anything but i wouldn t mind just like disappearing and just chilling on the top of a mountain or something like that i m sorry that this is so long i just feel really empty and it s my birthday i feel bad that i can t be happy for my parent i love them so much and i wish they knew how much i do but i m just feeling really exhausted all the time i don t know sorry if i selfish in this post i don t mean to i just feel really empty when i can think clearly almost like i built my personality around being with people thanks for listening whoever read this it really mean a lot to me,1
typical feeling at bedtime this is a good a it get struggling to remember a time when i looked forward to waking up,1
i return to work after a year of sitting at home with depression in this year i had to have a prosthesis put in my shoulder i am year old because of my past and depression my relationship with my colleague have diluted i ve said and done some bad thing that i couldn t help myself i wa just exhausted i realize that it is also difficult and strange for them but for me it is really difficult i still have anxiety attack daily with two teenager in the house the stress is certainly not gone due to stress i lost my hearing on my right side i got meniere s disease because of it i am sorry that there is no understanding for my situation now i had to have an ultrasound of my shoulder and it turn out that i have calcification it will probably need surgery again which i certainly don t like this would be the th time it s the first time i ve posted something like this anywhere on the internet i just had to write it off i really don t feel accepted in this world it s really difficult thanks for taking the time to read this,1
i wish i could be attractive taller funnier be everything woman find attractive instead i m the complete opposite i ve gotten more and more depressed last few month to the point where i start up depressing conversation so i started to stay away from people or stay silent with friend i m ugly and i ll never be loved and that s not something easy to carry on knowing full well i m and never even come close to a relationship i hope i die soon because i don t want to be alive and alone like this,1
