clean_text,is_depression
we understand that most people who reply immediately to an op with an invitation to talk privately mean only to help but this type of response usually lead to either disappointment or disaster it usually work out quite differently here than when you say pm me anytime in a casual social context we have huge admiration and appreciation for the goodwill and good citizenship of so many of you who support others here and flag inappropriate content even more so because we know that so many of you are struggling yourselves we re hard at work behind the scene on more information and resource to make it easier to give and get quality help here this is just a small start our new wiki page explains in detail why it s much better to respond in public comment at least until you ve gotten to know someone it will be maintained at r depression wiki private contact and the full text of the current version is below summary anyone who while acting a a helper invite or accepts private contact i e pm chat or any kind of offsite communication early in the conversion is showing either bad intention or bad judgement either way it s unwise to trust them pm me anytime seems like a kind and generous offer and it might be perfectly well meaning but unless and until a solid rapport ha been established it s just not a wise idea here are some point to consider before you offer or accept an invitation to communicate privately by posting supportive reply publicly you ll help more people than just the op if your response are of good quality you ll educate and inspire other helper the 9 90 rule http en wikipedia org wiki rule internet culture applies here a much a it doe anywhere else on the internet people who are struggling with serious mental health issue often justifiably have a low tolerance for disappointment and a high level of ever changing emotional need unless the helper is able to make a 00 commitment to be there for them in every way for a long a necessary offering a personal inbox a a resource is likely to do more harm than good this is why mental health crisis line responder usually don t give their name and caller aren t allowed to request specific responder it s much healthier and safer for the caller to develop a relationship with the agency a a whole analogously it s much safer and healthier for our ops to develop a relationship with the community a a whole even trained responder are generally not allowed to work high intensity situation alone it s partly about availability but it s mostly about wider perspective and preventing compassion fatigue if a helper get in over their head with someone whose mental health issue including suicidality which is often comorbid with depression escalate in a pm conversation it s much harder for others including the r depression and r suicidewatch moderator to help contrary to common assumption moderator can t see or police pm in our observation over many year the people who say pm me the most are consistently the one with the least understanding of mental health issue and mental health support we all have gap in our knowledge and in our ability to communicate effectively community input mitigates these limitation there s no reason why someone who s truly here to help would want to hide their response from community scrutiny if helper are concerned about their own privacy keep in mind that self disclosure when used supportively is more about the feeling than the detail and that we have no problem here with the use of alt throwaway account and have no restriction on account age or karma we all know the internet is used by some people to exploit or abuse others these people do want to hide their deceptive and manipulative response from everyone except their victim there are many of them who specifically target those who are vulnerable because of mental health issue if a helper invite an op to talk privately and give them a good supportive experience they ve primed that person to be more vulnerable to abuser this sort of cognitive priming tends to be particularly effective when someone s in a state of mental health crisis when people rely more on heuristic than critical reasoning if ops want to talk privately posting on a wide open anonymous forum like reddit might not be the best option although we don t recommend it we do allow ops to request private contact when asking for support if you want to do this please keep your expectation realistic and to have a careful look at the history of anyone who offer to pm before opening up to them,1
welcome to r depression s check in post a place to take a moment and share what is going on and how you are doing if you have an accomplishment you want to talk about these shouldn t be standalone post in the sub a they violate the role model rule but are welcome here or are having a tough time but prefer not to make your own post this is a place you can share our subreddit rule are located in the sidebar you can also always access them at r depression about rule since all of them exist for important safety reason we ask everyone here to read and follow them please click report on any harmful content you see here we always want to know and deal a soon a we can we also have several wikis there for help with finding and giving support r depression wiki what is depression provides guidance about what is and isn t a depressive disorder guidance on the complex nature of the illness that are usually grouped under the depression label and redirect information for common off topic issue r depression wiki giving help offer information on the nature and value of peer support for mental health issue in general and lot of guidance for learning what is and isn t usually helpful in giving peer support ysk that the type of rule violation that we most frequently see interfering with people getting safe and relevant support here are people breaking the private contact rule you should never trust anyone who try to get you into a private conversation in response to a post here see r depression wiki private contact i m here to help post this show that you don t understand the most basic principle of peer support especially selectivity the giving help wiki explains more about this role modelling i e achievement or advice post this is an expert free zone that s what peer support mean rule we know that internet culture celebrate not just bragging about your achievement but bragging about your good intention nothing like that is ever acceptable here content that s more about making a statement or casually polling the sub than seeking personal support or in a comment giving it rule and 0 off topic post about difficult situation or circumstance including interpersonal loss grief sadness anger and other difficult emotion are not mental illness the what is depression wiki ha suggestion for other place to post about these issue which are 00 valid and serious but inappropriate here,1
anyone else instead of sleeping more when depressed stay up all night to avoid the next day from coming sooner may be the social anxiety in me but life is so much more peaceful when everyone else is asleep and not expecting thing of you,1
i ve kind of stuffed around a lot in my life delaying the inevitable of having to work a job and be a responsible adult and i m but the longest i ve ever held a job wa 9 month it wasn t that i m lazy i wa always doing other thing i enjoy but i know now unemployment ha caused most of my depression recently i just feel utterly hopeless when i think soon enough i ll have to move out on my own in some shitty house working a job i couldn t care le about to me it just seems like the perfect recipe to depression,1
sleep is my greatest and most comforting escape whenever i wake up these day the literal very first emotion i feel is just misery and reminding myself of all my problem i can t even have a single second to myself it s like waking up everyday is just welcoming yourself back to hell,1
i m year old turning soon in a few month i live in constant dread i have no passion no goal no special achievement in my life and never been in a relationship i don t know what i want nor what i m doing in this so called life everything just feel exhausting i cry myself to sleep everyday i also feel extremely disconnected from others i don t fit in even though i try the hardest to be a decent human being i try to treat others with kindness and respect be a good listener help people when they need my help work hard exercise on daily basis take a good care of my appearance but no matter how hard i try to present myself at best i still feel i don t fit in i still feel empty unworthy and unwanted i want to do something that i could be proud of but no matter what i do i still never feel i m good enough even for myself i crave for meaningful connection i want to have someone to share and spend my day with laugh with cry with share my handmade gift with just to see smile on their face someone that feel like home because i ve been feeling homeless all this time i want to feel loved cared for and wanted for once but it s like it s just this idea of meaningful connection that i have in my head i can even barely hold a conversation whenever i try to talk to someone i feel extremely drained i m stuck in this rabbit hole between feeling extremely lonely and not having energy to talk at the same time i don t know i just feel like i m a failure human being and want to completely disappear thanks for reading my long rant i don t have anywhere else to get my mind off,1
i live alone and despite me being prone to loneliness a i find myself to be emotionally needy i seem to have the urge to cut important people out of my life when i get depressed friend girlfriend i feel easily annoyed and judgmental even if they did nothing wrong i can t explain it maybe by posting here i can find some people that can relate it sort of like a feeling of i am better off alone doe anyone else find themselves constantly having the urge to push people away it feel like i am being consumed by depression again,1
i m not looking for sympathy just simply to state why i m done trying to survive i m sitting here in the dark cry my eye out before my th birthday knowing it s the last birthday i ll ever have i m tired of fighting for my life every single day sense i wa i ve been fighting i can t do it anymore i m exhausted this illness ha broken my relationship with people i can t mend and everyone is done with me and i understand i just hope everyone understands why i ve made the decision i have if my husband somehow magically find this i love you more than anything and i m sorry i had to leave this way until we meet again my squishy,1
i don t know how to communicate all of my thought stay inside me instead of telling them to other people like i should my mind simply won t let me i try i really try sometimes and i have so many of them but they get lost my mind is a endless nightmare of thought of despair and hatred towards myself i feel numb and over emotional at the same time and i dont know what to do i feel like a horrible waste of human space stripped down to my bone by my past and my seemingly dim future,1
mom i m sad it hurt in my heart the feeling fall into my stomach i can t stop the tear when they start mom i m sad that i never did anything that i never achieved anything that everything just fell apart i can t get up in the morning i can t focus on anything but the sadness i can t put my clean clothes away i don t have the energy to try i sleep all day because it make time go by faster it s hard for me to try and take care of my dog because that mean getting up my thought race all day about what could have been mom i m sad because i don t know if i can make it i don t know if i can keep going i don t want to break you and dad heart but i think my heart ha been broken for a very long time the fight inside me is starting to slow down everything is turning black i don t know if i can make my way to see the light anymore,1
i ve been struggling with depression for a long time now but i just my first severe instance of depersonalization and it scared me so badly i m not even entirely sure why but something about the fact that i just spent over an hour lying on the floor feeling like my body didn t really belong to me and i might not be real is so extremely unsettling to me i feel more mentally and physically myself now and just trying to process what happened is really difficult if anyone ha any kind of comfort or advice about depersonalization i d appreciate it,1
idk how to elaborate on it i just started suddenly cry for no real reason and couldn t stop for like 0 minute doe anyone else have this problem i m just wondering,1
i tried to help his family abandoned him so it wa really hard to change his perspective im addict too gambling addiction but i will do better i hope sorry just a rant i found about it yesterday his life situation forced him to live in a mental hospital for last year and at the beginning of march he wanted to go to the germany to work a escort march he mentioned that he leaf tomorrow march i texted are you alive yesterday by googling him i found a necrology of him he killed himself march he texted many time to me about suicide thought im so sad,1
to me it seems like an empty meaningless phrase people use like cool but it s not going to help the fact that i m broke can t get out of bed some day and struggling through live now,1
my father committed suicide day before my th birthday i still remember this day i don t really have any memory of him so i m not really sad but for a long time i wa kinda angry at him for letting u alone with a mother like that but i realized some time ago that himself didn t want to be with her anymore and he also had a difficult life i think i m pretty sure he also had depression i feel stupid for being angry at him for so long over something like that i m happy for him now he doesn t have to suffer anymore he s free from his sadness just needed to let these thought out,1
i don t think i have the ball to do it but i ve become obsessed with the idea of killing myself all i can think about is suicide i ve developed a deep and genuine hatred for myself i don t want to live to see another day i don t want to get better bc i don t deserve it i wish i had the courage to kill myself,1
tw suicide yea so my recent symptom of depression wa that i thought i wa really really old i m lol there were numerous occasion where i had to convince myself of my actual age because my brain wa certain i m or had to count year from my birthday and repeat to myself over and over that i m i thought most of it wa because i m seeing a lot of successful people on social medium younger than me and because i m not finished with my uni yet because i m repeating a year but during therapy today i realized that beyond those reason i also had this subconscious plan in my head that i will barely make it past 0 like top and then i will be dead i have no idea where it came from i m not suicidal i don t think i ever wa but my brain seems convinced that by the time i m 0 i will develop suicidal thought and then before i will kill myself no wonder i thought i wa so old i have a little more than 0 year before my deadline lol and that s being generous idk why i wrote this i will probably delete this later i just needed to dump this info somewhere i don t want to worry my friend and family,1
got no one to talk to have no one around i ve been procrastinating on something for so long and i have no idea when i ll ever become serious or steadfast i just feel like a total waste i ve isolated myself which is making me go crazy right now no friend at all i m literally alone now feel like shit,1
i m sitting on my bed alone in my dark room smoking weed looking at the night sky and old photo listening to music i wa listening year ago and thinking about those time when everything wa fine and i knew le than i know right know it hurt so much physically and mentally,1
i hate myself so much for being like that when they re just minding their business sometimes i just see people so casually happy and hugging and being close or just visibly happy in general and i just feel so bitter they don t deserve me being so shitty over their happiness i can t help it i know i m garbage i know i don t deserve to be like them but sometimes i see people hugging and i wish i knew what it felt like to be hugged and cared for like that so badly it hurt,1
i ve been in a bad spot for a long time i ve dealt with a lot of grief a lot of handling shit on my own and trying to keep up appearance but thing took a turn for the worse when i had a traumatic event a few month ago that sent me over the edge i developed post traumatic stress disorder from it all and coping since ha been excruciatingly difficult i threw myself into work for about a month and a half i quickly burned out the trigger became an everyday occurrence i wanted help i needed help but i wa afraid every hand extended towards me would only reach to choke me those around me could drown me in an ocean of love and i d never feel wet my clothes may be wet but my skin my heart would feel dry a a desert i feel so closed off yet i crave closeness i can t even remember the last few month but from what i can i ve been destructive i ve been in so much emotional pain that i ve unintentionally caused emotional pain nothing is ever good enough for me it s not a conscious thing you see it s me i ve never felt good enough for anyone nor at anything i did these feeling of failure disappointment overwhelm me most day i m 0 without much to show for it this fight to see another day is wearing me out i keep getting knocked down and i know more is to come from life i just don t see an end to this emotional torture within my mind,1
and i m running out of time to decide i couldn t give a shit le about my major about internship about anything i don t know how to fix myself and i can t bring myself to try anything anymore if i manage to survive past the next few year which seems to be getting exponentially difficult i m going to have fucked over my career or myself now i have no good option,1
i m just sick of global society i m sick of the direction we re heading it really feel like neo techno feudalism imho the purpose of society should be to eliminate reduce human suffering and i just don t see that happening i don t see that happening based on the amount of homelessness i see i don t see that happening in term of climate issue and reducing ghg emission amp other pollution i don t see young people being supported high cost of living debt low wage for the u exclusively where is free cheap healthcare for all where is free public higher education where is cheap healthy convenient food where is affordable childcare and the counter i ve heard to these thing have been like oh there s progress being made rent control more scholarship opportunity young people well you should get involved i ve been involved it s so bureaucratic and soul crushing you lose vision of the bigger picture the reason you got involved well just keep at it why tf would i keep at it when i know i m operating in a system that is built against me against my value and then like let s say you get an important piece of legislation passed great it ha no teeth it s not enforceable it ha no funding attached to it it s easily circumvented we have people sleeping on the sidewalk scared out of their mind while jeff bezos amp elon musk are rocketing themselves to space because why not yay rich people fun we have billionaire getting richer in a pandemic why would i be involved when politician i ve admired and supported have been able to accomplish so little or do what i consider to be reprehensible action i can only hope were done so out of political necessity i work a bullshit job that shouldn t exist but i m sure a fuck glad doe because survival but it doesn t align with my value in this environment i don t know if it would even be possible to have any job that aligned with my value which is so frigging depressing what do i want to do i want to help people great government healthcare nonprofit bureaucratic underfunded nightmare i just don t get it i m so sad i m so sad for the needle human suffering physical amp mental like i don t get how any sane mildly informed person would not have depression anxiety which suck i bet you can tell how much fun i am at party,1
seriously help this ha been killing me i feel super down and unmotivated but i also feel fine a lot of time and happy and can laugh my high aren t super high but my low are pretty low but every time i feel happy i always feel like i m faking everything overexaggerating my symtoms and am just a bad person overall i m diagnosed ha this happened to anybody else what do i do,1
i m done et je n essaie m me plus j fatigu de rusher mentalement et m me le psychologues ne peuvent plus m aider a ne peut pa tre r solu j suis in comme a je ne sais pa ce que je fais ici je pourrai pa finir cette ann e inqui tez vous pa inqui tez vous juste plus je peux pa tre aid et je remarque que ma pr sence ne fait que tanner tout le monde je pourrai jamais m adapter penser normalement comprendre normalement et personne n a s puiser vouloir m aider l dedans,1
i have been suffering from what i can only imagine is some kind of fairly severe depression for almost year now i m sorry if this post is hard to read i m new to redit and have been reading post in this sub and it just made me feel moved to share my story to start off my depression started almost year ago i wa in a wonderful relationship with this beautiful girl i had met in highschool and i had moved away to college but i still came home every weekend to see her everything wa going great and then over the course of a few week or month i don t even remember how it really started i just began to get more and more depressed at first i didn t think anything of it i m the middle child of other boy we grew up with a very abusive father until i wa when my mom took u and left and i just always through depression wa something only weak people got and i never fully understood it although now i know that my real father struggled while mental illness and sever depression anyway back to my story every in my life wa going great i had made new friend in college and my relationship wa going great i just could feel myself becoming more and more closed off and lonely even though i wa surrounded by amazing friend and family i began to fight with my girlfriend because she could tell i wa being distant we started to fight more and more the the distance only made it worse when i finally did open up to her all she knew to do wa tell her mother with made me miserable i hated that fact that i thought someone saw me a weak and i started to dread seeing her and her family a couple month into my depression and my girlfriend ha become the only person who truly know how i feel and is the only person i ever confide in then one day a close friend of my girlfriend commented suicide this absolutely destroyed her she became extremely depressed and started to have suicidal thought i then pushed all my problem aside and did my best to help her through her issue i took her to counseling and did everything i could to help her but she slowly got better and wa never the same and now with u both being depressed our relationship became miserable neither one of u were happy and we thought that if we split up maybe we would be able to find some joy in our life again so we broke up in made and these last 0 month have been the worst of my life she wa my best friend and the only person in the world i have ever loved it s gotten easier these past few month but i have lost all joy in my life everything i used to love i have no passion for anymore i m still in college but i don t every compete any off my work i never go to class i hardly ever sleep ill go or night sleeping maybe hour a night then ill just sleep hour straight i find no meaning in life anymore i just feel this giant empty hole in my chest that i can t feel my grandmother died last month we were extremely close and i never even shed a tear the rest of my family wa balling and i wa just sitting there with no emotion i m never happy i m not even sad i just feel absolutely nothing almost every other night i put my pistol to my head just hoping it ll go off because i m not man enough to actually pull the trigger i ve tried to move on and tried to get better i just don t know what to do and i have no one to tell i transferred college so i lost all the friend i had and i m too embarrassed to tell me family i ve read every self help book i can find and nothing doe it for me i just keep praying that one day soon god will take me off this earth because i don t know how to keep living like this i m sorry if this is too long and i know i jump around a lot and everything may not make sense i just wanted to get this off my chest and i m thankful there is a place for me to,1
