clean_text,is_depression
i am a male within the armed force and never really got the chance to speak my mind about a lot of thing i wa always told by everyone thats male shouldn t cry or even show a slight a bit of sadness or else it would redeem them weak a little bit if background before the military i wa a person that would always have friend along with people i thought they would appreciate who i am later on bad luck started to come around or at least i thought it wa bad luck to this day i do not have any idea why thing happen around me or people i love it seemed like every week or month or so i would go to a funeral that wa among all my friend i made accident suicide cancer or even by natural cause so far i been to funeral at this point and not able to cry or shed a tear it seems like whenever i try to show an emotion to what ha happened it never doe then people look at me like a monster and think i am a psycho or a robot in reality i am lost in the void of either to try to keep or make more friend eventually i got to enlisting into the military to serve or find a purpose in life and eventually found myself in a deeper hole i remember i had a platoon size or so group of buddy i drank and had fun with a brotherhood many would call it a home away from home that did not really last long one by one they killed themselves due to various amount of situation either it be from a divorce or just pure depression that dragged them to the ground despite all these thing i came to the conclusion that i always will think i am a robot or even a ghost that sens nothing but just what go on non human to the point where at one point i saw them paint their brain on the wall a i walked in to give them a well needed drink my reaction wa nothing and to just calmly report it to the mp on base i am sorry elijah currently in the service still have about two year left my wife at home with the dog i do feel love for both of them but for me not at all i feel guilt in the fact of it all happening like i am the bad luck charm i been seeing what seems like people that i used to speak to and where alive around me at time my old friend that could have been around but aren t i am not much of a paranormal type person but i feel them watching me or even expecting me to join them at some point a heavy weight on my shoulder if you will i can t lose myself in thought or else they are everywhere so i keep it to myself and ruck on but believe me the demon have learned how to swim after i tried drowning them with drinking i keep going in life but what purpose what it be if i keep losing those i love whoever read this thank you to my wife a well i love you and our dog despite my dark situation i don t want my demon to win but they try every night who know if i will ever wake up to see something bright again,1
throwaway acct never really post so excuse formatting or content i have hit the point now where i am really wondering what the point of it all is i m very tired i feel like i ve been running forever my medical bill are continuing to pile up i haven t been working because of my medical issue so money ha become my biggest real life issue my relationship with family and friend are deteriorating so quickly i don t even know how to stop it my education proved to be the biggest waste of time my work skill are so unremarkable that i cant get anything more than a warehouse job i m a complete definition of a loser i feel like my life is spiraling out of control it feel like it s all my fault and i know it is i just don t know how to fix anything and these random event keep happening to me that make me question if maybe it is just some cosmic entity screwing with me because every time i tried to do something for someone else or tried just taking action to do better somehow it ended up in failure i tried getting a new job and i unfortunately my medical problem hit causing me to lose that new job just a month after getting it prior to that i took a better job offer only to get hit with even worse working condition for an additional 0 hence me leaving to try to get a new job or how about the two time i went christmas shopping for my family i had to replace two tire on my car one each time i went out i mysteriously got a flat tire that went unnoticed both time resulting in me having to buy new one because the sidewall were screwed or my favorite one i decided to take a trip to another state on a whim one weekend for a concert at that time i had felt that i wa at the lowest i could get so i said screw it and decided to go i decided to go out the night before to check out the city and found a local band playing a bar i ordered a beer and the next thing i remember is waking up in a hospital they proceeded to then let me just leave the hospital and i wandered the city with a dead phone for a few hour looking for my car to go home i got a lot of nice thought from family and friend initially but then the jokey so you didn t get raped did you and then just laughing it off most likely because i m a male i honestly don t know if i did i remember nothing and i would rather it just stay that way everything i do in my life seems to result in the worst possible outcome whether it s my fault noticeably or whether i want to blame the void for all my problem the outcome is still the same and my pile of problem doesn t change i just want to do right but i can t seem to do that i want to give up completely every time i think thing can t get worse they do this isn t a final post or anything like that i just want to scream everyone look and talk to me like i m some stooge and maybe i am but damnit i just want people to care i m trying but failing at every corner so i am at the point now where i don t do anything i ve sat unemployed with a friend a my flatmate for a bit now and i get the sense he doesn t believe my medical issue and i sense this relationship ha also lost it end i m so lost i don t know where to go from here hang in there everyone i m sure it get better sometime just maybe not soon,1
the phrase and concept it get s better eventually how can anyone keep living without something other than that flawed statement there s no trick or ploy here i just don t get it i m tired of trying to convince myself that idea ha merit or is at least worth pursuing for myself i m tired of leaning solely on that because time after time i can t find anything in this world to look forward to anything to believe in to want maybe no one will read this post maybe everyone hyperbole will i know i don t have a flashy premise i know i m just some random person the average scroller doesn t have to get attached to or invested in because they may never hear from me again i know this question is gigantic and a colossal ask to any one person i just need something random aside fuck betrayal fuck blatant liar,1
i don t want to d e but also don t love the idea of being alive i feel like im just existing my life somehow sound really cool on paper and in real life it s extremely meh im in a long term relationship working in entertainment like i always wanted for myself living in new york i have some solid friend but none of it feel good am i just an entitled brat i feel no excitement anymore im just constantly working on arbitrary goal that i set for myself so i don t just lay in bed all day call it high functioning i don t really want to keep doing this whole thing i m tired and over it and i ve gone through too much shit this past year and i am still dealing with ptsd and sa stuff and i just feel like i don t want to deal with it anymore i want to give my life to someone else and go live on a beach somewhere and i know that life is hard and i hate that i wish it wasn t so hard i m not strong enough to keep fighting i want to give up seeking advice please or some word of wisdom or something how do i find my spark again,1
what are you been doing lately how life s going for you in my side i started studying at college i m very proud of what i ve accomplished mostly managing my anxiety still got a lot of work to do the only thing that is kinda bothering me now is that i feel lonely abandoned,1
hi i wa wondering if anyone ha this happen to them i have have had depression for decade i have good day and bad day no period that last for week or month like i did when i first started having symptom 0 year ago thank god it is mostly occasional bad bout most often i just have a dull low depression that i can dell with using moving muscle using cognitive dispute today i had one of the rare event that i used to get often i wake up early have a cup or two of coffee yet i feel really exhausted i slept fine the night before i end up having breakfast but that exhausted feeling becomes overwhelming and i go back to bet by 9am the entire day consists of me sleeping having lucid bat shit crazy bizarre dream the dream are not nightmare in fact they are rather creative but the local and situation are like the came from somebody imagination in a distant galaxy they would make really interesting sci fi fantasy i also dream about being lonely i have no family few friend one thing i remember wa this gut wrenching sadness about a girl i dated over 0 year ago thought she wa the one but it fell apart after about 0 to hour i get up have something to eat i feel hung over an d it is like a storm passed through my brain spent it s energy and now calm ha returned i wa wondering if anyone else had had similar experience like this it would be concerning if it wa a frequent occurrence which it once wa in the early day of depression again that wa decade ago thanks in advance for any observation or comment peace,1
is there any way to bring my appetite back due to unfortunate life event that gave me emotional stress over the past time i ve started loosing my appetite while some people were gaining weight this quarantine it wa the opposite for me this isn t normal for me since i wa enjoying eating meal now food doesn t faze me that much i ve lost desire to eat and i m concerned about my health i miss the feeling of enjoying food p s sorry i forgot to add i m a minor and i m strictly forbidden to go outside i wa hoping if i could do anything inside the house that s useful but i ll consider other comment given thank you,1
it will be two year this november since my brother died from a fentanyl overdose this completely shook up the family dynamic i moved back home to be closer to them about a year before his death while i am happy i did get to spend his last birthday with him since he is gone and the family is all split up now i hate living here i used to make double doing the type of work that i do here where i last lived my job is actually financially draining me i am a caregiver aid for disabled kid and have been for over year but ever since my brother died i find myself in very dark place then i get really angry for a second because i know he is gone and never coming back then throw in the caregiver fatigue with the grieving depression and i just feel so crazy in my head sometimes one minute i m fine the next minute i hate everyone inflation isn t helping because i am having to skip meal to make sure my kid are fed which also isn t helping my mental health i dunno how do you all cope,1
i can t stand the constant shitty feeling of depression in my chest head and stomach idk how to put it into word but pretty sure every depressed person know what i mean i can t shake the feeling and everything is starting to get under my skin and send me into such a downwards spiral of overthinking and overanalyzing everything so much to the point that i overanalyze feeling sad in the first place and minimize my own feeling i m not motivated to do anything except sit around like a blob and waste time and space my fiance is a blessing and doe so much to make me feel better but he can t be my savior and it s been so hard just to get through the work day and go through the motion i know it s temporary and will pas cause that s the illness but i feel so awful and helpless rn i forgot what i m supposed to do i hope typing this out will make me feel better thanks so much for reading and have a wonderful night,1
i m not writing this in a negative way what is your point having a point make the difference i think between your life you need to know why you are doing something before you do it,1
it feel we live in such a cruel world people torment each other always wanting to make others feel worse give each other covid or hate or rage or despair i don t sleep well i ve met some people recently whom have treated me badly ghosted me pretended to be my good friend and i ve suffered a lot of emotional pain i always ask what ha been the point of all of this i ve had some terrible pain last few year what wa the point or is it all meaningless,1
so for awhile now i ve tried multiple time to hang myself and also tried to slit my wrist but all my suicide attempt have failed and im trying to find happiness in life and find a reason to live but everday i just wan na end all my suffering anyways here s why i feel suicidal so basically my mom and dad are abusive and make me feel like shit and then my brother and sister don t uderstand what im going through so they make it worse and my parent threated me if i call cps or anyone about what happens at the house i would get whooped till i turned red and got brusies and alot of bad thing somebody please help me before i take my life,1
i ve felt like this for a bit but never super realized until i looked into a depression a i ve thought more and more recently that i might have depression i ve just kind of been watching youtube and show recently not doing anything i like recently i haven t had any good motivation to get up and do stuff like playing video game even though i want to i just can t get myself to i ve been failing school i can t motivate myself to sit down and even do that which i really really need to do and i feel bad for it too since i haven t done really anything and my mom stuck her neck out to help me i ve just about always had good grade up until spring of last year i think i m always happy when out doing stuff around people basically but i m not always feeling that way i ve just kind of been feeling off and a bit sad i want to reach out to people but i don t have the courage to do so even if they re a relative or a close friend i don t want anyone feeling sad because i am and i m just kind of trying to keep people other than myself happy people have asked me sometimes if i m ok but i always respond with i m fine sometimes i know like at the beginning of conversation i sound a bit sad which is why people ask if i m ok but then i kind of just go to a normal somewhat happy tone i don t want to really say i m depressed cause i think it s just my own fault for being too lazy and i know recently especially i haven t been getting to sleep really at a time i should just cause i don t feel tired basically ever so i just stay awake and sometimes force myself to sleep i m not really ever cry which isn t very depression like which is guess is kind of why i ve just thought for awhile that i don t which i probably don t i m sure i m exaggerating but i don t really get to a point where i feel sleepy and then when i do go to sleep i sleep for hour and even if i do set alarm i wake up but i m just not motivated enough to actually get up so i usually just fall back asleep but i just haven t told anyone up until now especially not irl until now but even this ha taken some courage to admit even to myself but i probably didn t say everything a im just kind of piecing stuff together in no specific order or anything and just ramblind on but i m sorry this ha been long thank you for reading and have a nice day or night i did forget to mention some stuff i don t really have suicidal thought i mean i ve thought of suicide but never actually thought about doing it and i have been thinking about talking to a friend that i believe ha had depression in the past but i don t know if they still do so i don t really want to put that weight on their shoulder a well and also i haven t been eating a much probably not because of depression if i even have it which i m sure i don t at this point and also my hygiene i haven t been taking care of my hygiene the best i kind of stopped brushing my teeth for awhile i hate to admit it but my teeth are pretty yellowed and i haven t really been taking care of thing such a acne a well,1
i feel like i can t get high enough to forget the shit that s happening in life rn i want to self harm so bad because i m so sad and idk what to do with myself and how i ve reacted to my relationship struggle,1
i think i am having a nervous breakdown i need help i have too much going on i cant even get into detail i had a panic attack and i kept hitting myself in the face it 0am right now i dont want to say whats going on particularly but i have absolutely nobody there for me or anybody willing to help i had a panic attack about minute ago it am a im writing this right now i got up from my bed and walked into the bathroom and i got into the bathtub and sat down and stared at the wall for minute i dont know where my head is ive been sitting here for 0 minute now i really need help right now ive never posted anything like this to a subreddit or any other website so this is almost a last resort for me,1
f i am just so tired i hate my life i know there s a beautiful side to life but oh my god i don t even wan na see it if the thing i ve been through are always going to be in the back of my head i don t feel guilty about leaving my friend or family anymore i just feel ready what i m worried about is failing,1
everyone i have ever met in my life ha told me that i m beautiful some even the most beautiful that they have ever seen all my life i ve expected the rest of the world to bow down before my beauty and tell me that i m beautiful i always rely on that validation and reassurance i keep on waiting for people to tell me that i m beautiful i keep track of who tell me i m beautiful and who hasn t for those who haven t i wonder if they think i m beautiful this happened with my 0 year old same sex female teacher i wa expecting her to tell me that i m beautiful even a she wa rejecting me and i noticed that she didn t tell me what i wanted to hear and just pointed out aspect about my personality i wa cry over it my own thinking ha led to me having many problem in life i lack even the most basic common sense even when something is so obvious like flying to germany and showing up unannounced at the airport asking to be picked up at pm and expecting to free load for two week with relative i haven t seen in year over christmas being invited to a friend s birthday party and not even talking to her and wondering why she became cold to me even at work when toothpick fell i wa picking them up to put them back on the bottle i wa stacking clothes that they kept on falling my coworkers who are younger than me helped me and their mind are more mature than mine when my former professor 0 year my senior told me he loved me and that i wa the most beautiful woman he ha ever met i wa blown away i wa so distracted by him telling me that i wa beautiful that i could not see that he could have been lying i have received a couple of complaint about my personality someone told me yes you are beautiful in look but ugly a hell at heart you are narcissistic and manipulative you surely do act like the world revolves around you another person ha told me you told me that you are when i wa talking to you i felt like i wa talking to a year old you are a very immature woman and you re not that bright either is this why i don t have any friend is there more to life than being beautiful would people find my immaturity to be unattractive,1
i don t know what to feel but i just am tired and over it and there s no end to running on a hamster wheel of constant sadness ugh,1
i cant do this i just cant anymore i wan na be happy again im dealing with lot rn ever since i watched some verg graphic gore smoked weed had dpdr researched solipsism it all too much for me i wan na be happy again i just cant see the world the same anymore but i want to please someone help ive had this kind of depression for year it come and go i hadnt had any kind of major depression tho for a while this doesnt feel like itll go away i rly need to know and make sure itll go away because i just cant especially at night thats when it get rly bad i just don t know what to do this doesn t feel like it ll ever go away please please help im desperate i just wan na be happy again i can t deal with this again,1
death seek me life besieges me i want to die why oh why fuck bring the pain i am ready for the ocean whatever happens i ll be with god please god forgive me i have failed you i am so confused please help me why is my life such a painful struggle i want peace in sobriety with you forgive me god i am sorry,1
i ve decided to mourn my break up of year together that happened week ago last night i dropped all my hope and faith she d come back to me we both were evil to each other definitely not ready for one another we did love each other like no one else we both were each other s first love and then my heart my soul feel like some nasty hand came to my soul ripped apart half of my heart watched me die on the street alone and giggled at me i don t want this amount of pain it almost led me to act on you know what last night i ve ruined every decision i ve made in life i don t want to ruin more tomorrow is not promised then i want to change my personality since i never made friend with who i am i want to i just want to change 0 degree of who i am today but this pain it s killing me how do i get over this pain a quickly a possible i ve no friend to speak to about it i m alone here and dying to just have someone in a similar experience and help me with it irl friend i haven t had in so many year and being at home is killing me too for so many year but i want to change it all,1
i think i m starting to feel an emotion that i haven t experienced naturally in year you know that feeling where you have a vacation coming up and the whole week before you re like excited because you have something to look forward to i ve been feeling that all week but i have no plan or break until the end of the semester i wa trying to express this feeling out loud to my friend when it occurred to me is this what happy people feel like like do they feel satisfied just walking around all day it s like my stomach is warm and content even though nothing is different and i have nothing going on anyone else have thought on this,1
my appetite extremely lost itself day by day and week by week i can t even enjoy eating sweet anymore or even the most delicious food make me want to throw up except for liquid such a coke im addicted to soda and milk tea i feel sad and pity myself im fully aware how my health is deteriorating yet i dont know how to deal with it i suffer from did mdd bipolar and cptsd i m in early phase of therapy so thing aren t really going good these day im really concerned about my health im already severely wasted underweight sometimes i just think thats it better to not eat cause everytime i eat i get depressed feel discomfort and idk why from one cup of rice to one half cup to and now i only eat spoon per meal i don t even drink much water i want to change it but i just dont know how,1
